{
  "$schema": "https://schemas.premid.app/metadata/1.17",
  "apiVersion": 1,
  "author": {
    "id": "193714715631812608",
    "name": "theusaf"
  },
  "service": "Canvas",
  "description": {
    "en": "Canvas by Instructure is the world's #1 Learning Management System for schools, teachers and educators. Learn more about implementing the best LMS today."
  },
  "url": [
    "learn.canvas.net",
    "canvas.instructure.com",
    "www.canvas.net",
    "ilearn.gavilan.edu"
  ],
  "regExp": "^https?[:][/][/]((learn|www)[.]canvas[.]net|canvas([.][a-z]+)+|([a-z0-9-]+[.])*instructure[.]com|ilearn[.]gavilan[.]edu)[/]",
  "version": "1.4.2",
  "logo": "https://cdn.rcd.gg/PreMiD/websites/C/Canvas/assets/logo.png",
  "thumbnail": "https://cdn.rcd.gg/PreMiD/websites/C/Canvas/assets/thumbnail.png",
  "color": "#e63d2f",
  "category": "other",
  "tags": [
    "education",
    "homework",
    "quizzes",
    "grading"
  ],
  "settings": [
    {
      "id": "privacyMode",
      "icon": "fas fa-user-secret",
      "title": "Privacy Mode",
      "value": false
    }
  ],
  "allowURLOverrides": true
}
