{
  "$schema": "https://schemas.premid.app/metadata/1.17",
  "apiVersion": 1,
  "author": {
    "name": "PreMiD",
    "id": "503557087041683458"
  },
  "contributors": [
    {
      "name": "Bas950",
      "id": "241278257335500811"
    },
    {
      "name": "alexbcberio",
      "id": "202915432175239169"
    }
  ],
  "service": "Emby",
  "description": {
    "en": "Your personal media on any device. Bringing all of your home videos, music, and photos together into one place has never been easier. Your personal Emby Server automatically converts and streams your media on-the-fly to play on any device.",
    "nl": "Uw persoonlijke media op elk apparaat. Het was nog nooit zo eenvoudig om al uw video's, muziek en foto's samen te brengen op één plek. Uw persoonlijke Emby-server converteert en streamt uw media automatisch om ze op elk apparaat af te spelen."
  },
  "url": [
    "emby.media",
    "app.emby.media"
  ],
  "regExp": "^https?[:][/][/].*[/]web[/]index[.]html[/]",
  "version": "1.7.4",
  "logo": "https://cdn.rcd.gg/PreMiD/websites/E/Emby/assets/logo.png",
  "thumbnail": "https://cdn.rcd.gg/PreMiD/websites/E/Emby/assets/thumbnail.png",
  "color": "#52B54B",
  "category": "videos",
  "tags": [
    "video",
    "movie",
    "tv",
    "media"
  ],
  "settings": [
    {
      "id": "showMediaTimestamps",
      "title": "Show media timestamps",
      "icon": "fad fa-play",
      "value": true
    },
    {
      "id": "showTimestamps",
      "title": "Show timestamps",
      "icon": "fad fa-stopwatch",
      "value": true
    },
    {
      "id": "showThumbnails",
      "title": "Show thumbnails",
      "icon": "fad fa-image",
      "value": true
    },
    {
      "id": "audDetail",
      "title": "Audio Details row1",
      "icon": "fas fa-comment-alt-edit",
      "value": "Listening to: %title%",
      "placeholder": "Use %title%, %artist%, %albumartist%, %releasedate%, {0}"
    },
    {
      "id": "audState",
      "title": "Audio Details row2",
      "icon": "fas fa-comment-alt-edit",
      "value": "By: %artist%",
      "placeholder": "Use %title%, %artist%, %albumartist%, %releasedate%, {0}"
    }
  ],
  "allowURLOverrides": true
}
